tconst,popularity,production_countries,averageRating,category,primaryName,birthYear,titles,votes,runtime_minutes,start_year,poster_url,video_link,overview,original_title,genres,languages
tt4485168,1.301,['BE'],6.5,actor,Martin Nissen,1995,Welcome Home - Welcome Home,6736.0,86.0,2015,https://image.tmdb.org/t/p/w154/y64OOZqbgmHk57Vk3KSrBTKGBz3.jpg,https://www.youtube.com/watch?v=yoDvpurHGGM,"Lucas (un lycéen de 16 ans) et Bert (un apprenti de 18 ans) fuient le bocal familial. Mais très vite, l'ennui refait surface et le sens de leur voyage leur échappe. Leur fugue va les mener au bord de la catastrophe. Elle déterminera le reste de leur existence. Chacun s'en sortira à sa manière...  La liberté a un prix. Ils vont payer la leur au prix fort.",Welcome Home,Drama,"en, fr"
tt4494706,2.738,"['LU', 'FR']",6.5,actress,Agathe Bonitzer,1989,Right Here Right Now - Right Here Right Now,6761.0,98.0,2016,https://image.tmdb.org/t/p/w154/7huMqd0QJRrCBB3e22tYxkPMAR5.jpg,https://www.youtube.com/watch?v=Olt8TSrBlGs,"Nora Sator, jeune trentenaire dynamique, commence sa carrière dans la haute finance.Quand elle apprend que son patron et sa femme ont fréquenté son père dans leur jeunesse, elle découvre qu’une mystérieuse rivalité les oppose encore.Ambitieuse, Nora gagne vite la confiance de ses supérieurs mais entretient des rapports compliqués avec son collègue Xavier, contrairement à sa sœur Maya qui succombe rapidement à ses charmes…Entre histoires de famille, de cœur et intrigues professionnelles, les destins s’entremêlent et les masques tombent.",Tout de suite maintenant,"Comedy, Drama, Romance","en, fr"
tt4530422,20.603,"['CA', 'US']",6.6,actor,Jovan Adepo,1988,Overlord - Overlord,111940.0,110.0,2018,https://image.tmdb.org/t/p/w154/fAc25khUQANUuSErwRnZgLZWXpr.jpg,https://www.youtube.com/watch?v=Msj_8RUIco8,"À la veille du débarquement, un groupe de parachutistes est largué en France occupée. Alors qu’ils luttent pour accomplir ce qui ressemble à une mission impossible, ils tombent sur un laboratoire secret dans lequel sont menées des expériences surnaturelles, aussi étranges que terrifiantes.",Overlord,"Action, Horror, Science Fiction, War","de, en, fr, ru"
tt4579914,5.314,['CA'],6.5,actor,Guillaume Lemay-Thivierge,1976,Nitro Rush - Nitro Rush,6752.0,97.0,2016,https://image.tmdb.org/t/p/w154/95smDJttEOVgHdKKIsWYRLuwZcM.jpg,https://www.youtube.com/watch?v=185817902,"Max a été condamné il y a six ans pour l'homicide involontaire d'un policier. Quand il apprend que son fils Théo, un génie informatique de 17 ans, vient d'être recruté par une organisation criminelle, Max décide alors de s'évader de prison afin d'empêcher Théo de commettre des fautes irréparables. Une fois à l'extérieur, il fait la connaissance de Daphné, une femme fatale qui dirige une opération dans laquelle Théo et son meilleur ami sont impliqués. Afin de protéger son enfant, Max devra prendre part à un vol périlleux qui consiste à dérober à deux scientifiques la formule chimique d'une drogue très populaire sur le marché noir appelée Nitro Rush.",Nitro Rush,"Action, Crime, Drama","en, fr"
tt4601102,7.991,['FR'],6.2,actor,Malik Zidi,1975,Made in France - Made in France,2587.0,89.0,2015,https://image.tmdb.org/t/p/w154/4RYbOorWc0soHNjKjELA5cL32JK.jpg,https://www.youtube.com/watch?v=w_TYVYwae8o,"Sam, journaliste indépendant, profite de sa culture musulmane pour infiltrer les milieux intégristes de la banlieue parisienne. Il se rapproche d’un groupe de quatre jeunes qui ont reçu pour mission de créer une cellule djihadiste et semer le chaos au cœur de Paris.",Made in France,"Crime, Drama, Thriller",fr
tt4630550,6.855,"['BE', 'FR']",6.5,actress,Adèle Haenel,1989,The Unknown Girl - La fille inconnue,10891.0,113.0,2016,https://image.tmdb.org/t/p/w154/dUoTKphxbtKDJPGcubw6IP6D8w5.jpg,https://www.youtube.com/watch?v=4TYCCPYdGTw,"Un soir, après l’heure de fermeture de son cabinet, Jenny, jeune médecin généraliste, entend sonner mais ne va pas ouvrir. Le lendemain, elle apprend par la police qu’on a retrouvé, non loin de là, une jeune fille morte, sans identité.",La Fille inconnue,"Crime, Drama, Mystery, Thriller",fr
tt4643432,5.056,['FR'],6.5,actor,Raphaël Personnaz,1981,In the Forests of Siberia - Dans les forêts de Sibérie,6821.0,105.0,2016,https://image.tmdb.org/t/p/w154/gAZhLgt9HOdTWj3bFDNPAOzo40l.jpg,https://www.youtube.com/watch?v=yvMFofZlfzc,"Pour assouvir un besoin de liberté, Teddy décide de partir loin du bruit du monde, et s’installe seul dans une cabane, sur les rives gelées du lac Baïkal.  Une nuit, perdu dans le blizzard, il est secouru par Aleksei, un Russe en cavale qui vit caché dans la forêt sibérienne depuis des années.  Entre ces deux hommes que tout oppose, l’amitié va naître aussi soudaine qu’essentielle.",Dans les forêts de Sibérie,"Adventure, Drama","en, fr, ru"
tt4680196,8.568,"['BE', 'FR']",6.5,actress,Natalie Portman,1981,Planetarium - Planétarium,6911.0,105.0,2016,https://image.tmdb.org/t/p/w154/cuwYVBOxIGwXAJH89yHnkqe3SbV.jpg,https://www.youtube.com/watch?v=tE9wYQo94_M,"Paris, fin des années 30.  Kate et Laura Barlow, deux jeunes mediums américaines, finissent leur tournée mondiale. Fasciné par leur don, un célèbre producteur de cinéma, André Korben, les engage pour tourner dans un film follement ambitieux. Prise dans le tourbillon du cinéma, des expérimentations et des sentiments, cette nouvelle famille ne voit pas ce que l'Europe s'apprête à vivre.",Planetarium,"Drama, Fantasy, Mystery","en, fr"
tt4714782,15.877,"['BE', 'CZ', 'FR', 'DE']",6.1,actress,Kristen Stewart,1990,Personal Shopper - Personal Shopper,45246.0,105.0,2016,https://image.tmdb.org/t/p/w154/rUjGo48rw9SuEfJ5ZxQMb1LfLZF.jpg,https://www.youtube.com/watch?v=KGmoWM-0CFY,"Maureen, une jeune américaine à Paris, s’occupe de la garde-robe d’une célébrité. C’est un travail qu’elle n’aime pas mais elle n’a pas trouvé mieux pour payer son séjour et attendre que se manifeste l’esprit de Lewis, son frère jumeau récemment disparu. Elle se met alors à recevoir sur son portable d’étranges messages anonymes…",Personal Shopper,"Drama, Mystery, Thriller","en, fr, sv"
tt4715652,1.722,"['PT', 'FR', 'DE']",6.5,actor,Reda Kateb,1977,The Beautiful Days of Aranjuez - The Beautiful Days of Aranjuez,6752.0,97.0,2016,https://image.tmdb.org/t/p/w154/wfBFRuVg5ZL9hYJik2k7QP5va2y.jpg,https://www.youtube.com/watch?v=GcKFTKcnRY0,"Un beau jour d’été. Un jardin. Une terrasse. Une femme et un homme sous les arbres, avec un vent d’été doux. Au loin, dans la vaste plaine, la silhouette de Paris.  Un dialogue commence, des questions et des réponses entre la femme et l’homme. Il s’agit d’expériences sexuelles, d’enfance, de souvenirs, de l’essence de l’été et de ce qui différencie les hommes et les femmes, la perspective féminine et la perception masculine. Derrière, dans la maison qui donne sur la terrasse, sur la femme et l’homme : l’écrivain, en train d’imaginer ce dialogue et de le taper à la machine. Ou est-ce l’inverse ? Seraient-ce les deux personnages, là dehors, qui lui racontent ce qu’il couche sur le papier : un ultime et long dialogue entre un homme et une femme ?",Les beaux jours d’Aranjuez,Drama,"de, en, fr"
tt4717402,15.361,"['FR', 'JP']",6.7,actor,Orelsan,1982,MFKZ - MFKZ,5541.0,94.0,2018,https://image.tmdb.org/t/p/w154/lwnkzrfBYXDK4JzQsTzSNjFNJVY.jpg,https://www.youtube.com/watch?v=k1Qor3xMfW0,"Angelino est un jeune loser parmi tant d’autres à Dark Meat City, une mégalopole sans pitié sous le soleil de Californie. La journée, il livre des pizzas dans tous les recoins de la ville et la nuit, il squatte une chambre d’hôtel minable avec son coloc Vinz et une armada de cafards qui font désormais un peu partie de sa famille. À la suite d’un accident de scooter lorsque son chemin a croisé par inadvertance la divine Luna, une fille aux cheveux noir de jais, notre jeune lascar commence à souffrir de maux de tête et d’étranges hallucinations. Des hallucinations, vous avez dit ? Hmm, peut-être pas... Pourchassé par des hommes en noir, Angelino n’a plus aucun doute : il est pris pour cible. Mais pourquoi lui ?",Mutafukaz,"Action, Animation, Comedy, Crime, Science Fiction","en, fr"
tt4720674,1.818,['CA'],6.5,actor,François Létourneau,1974,Paul à Québec - Paul à Québec,6748.0,98.0,2015,https://image.tmdb.org/t/p/w154/fu5MRrQS20rTF1kTt1N9PaCZorf.jpg,https://www.youtube.com/watch?v=Bknxis15RUM,"En 1999, Paul et sa conjointe Julie vivent de beaux moments avec leur jeune fille. Ils se cherchent une maison à Montréal et voient fréquemment leur famille, notamment les parents de Julie qui habitent St-Nicolas, en banlieue de Québec. Mais la maladie a frappé durement Roland, le fier et généreux patriarche de la famille, qui tente tant bien que mal de cacher l'ultimatum qu'il subit à ses enfants. Mais la vie étant ce quelle est, Roland devra être admis dans un centre de soins palliatifs alors que ses proches, dont Paul, devront apprivoiser l'idée de sa mort. Dans le processus, Paul se mettra au dessin.",Paul à Québec,"Comedy, Drama","en, fr"
tt4725842,9.746,"['BE', 'FR']",6.5,actor,Artus,1987,Girls with Balls - Girls with Balls,6948.0,77.0,2019,https://image.tmdb.org/t/p/w154/cxusiFpBgcbDCc9Y84PeKO0dM8l.jpg,https://www.youtube.com/watch?v=9X0GMOcZnYw,"Quand leur  mini-van déglingué conduit par leur coach tombe en rade au milieu de nulle part, elles ne se doutent pas qu'elles viennent de tomber dans un piège mortel tendu par une bande de chasseurs dégénérés qui ont décidé de pratiquer une traque d'un genre nouveau : la chasse à la blonde ! Pour les Falcons une longue, très longue nuit commence ; une course pour leur survie qui va mettre à l'épreuve leur esprit d'équipe et éprouver les liens qui les unissent. Mais sous leurs airs de victimes innocentes, les volleyeuses vont se révéler pleines de ressources. Au cœur de la forêt, les rôles des chasseurs et des proies vont peu à peu s'inverser...",Girls with Balls,"Comedy, Horror","en, fr"
tt4730986,7.276,"['FR', 'QA']",7.4,actress,Oulaya Amamra,1996,Divines - Divines,11299.0,105.0,2016,https://image.tmdb.org/t/p/w154/6P12dmdR0XFXXOPx1HsI8kT6yMX.jpg,https://www.youtube.com/watch?v=VT4YtWdK01M,"Dans un ghetto où se côtoient trafics et religion, Dounia a soif de pouvoir et de réussite. Soutenue par Maimouna, sa meilleure amie, elle décide de suivre les traces de Rebecca, une dealeuse respectée. Sa rencontre avec Djigui, un jeune danseur troublant de sensualité, va bouleverser son quotidien.",Divines,"Crime, Drama","en, fr"
tt4741714,8.742,['FR'],6.3,actor,Pierre Niney,1989,Five - Five,5746.0,102.0,2016,https://image.tmdb.org/t/p/w154/20WSLvExcsjv8wDBePiVpYeAgav.jpg,https://www.youtube.com/watch?v=cdwT6lYSWGI,"Cinq amis d'enfance rêvent depuis toujours d'habiter en colocation. Lorsque l’occasion d’emménager ensemble se présente, Julia, Vadim, Nestor et Timothée n’hésitent pas une seule seconde, surtout quand Samuel se propose de payer la moitié du loyer ! A peine installés, Samuel se retrouve sur la paille mais décide de ne rien dire aux autres et d'assumer sa part en se mettant à vendre de l'herbe. Mais n'est pas dealer qui veut et quand tout dégénère, Samuel n’a d’autres choix que de se tourner vers la seule famille qu'il lui reste : ses amis !",Five,"Comedy, Crime, Drama","en, fr"
tt4746484,6.894,"['BE', 'FR']",6.5,actress,Bérénice Bejo,1976,After Love - L'économie du couple,2590.0,100.0,2016,https://image.tmdb.org/t/p/w154/wp2eRqzSls30vcb5IgHauTadsNY.jpg,https://www.youtube.com/watch?v=mDpmIYR6kmY,"Après 15 ans de vie commune, Marie et Boris se séparent. Or, c'est elle qui a acheté la maison dans laquelle ils vivent avec leurs deux enfants, mais c'est lui qui l'a entièrement rénovée. A présent, ils sont obligés d'y cohabiter, Boris n'ayant pas les moyens de se reloger. A l'heure des comptes, aucun des deux ne veut lâcher sur ce qu'il juge avoir apporté.",L'économie du couple,Drama,fr
tt4746516,8.391,['FR'],6.0,actress,Adèle Haenel,1989,Orphan - Orpheline,1585.0,111.0,2017,https://image.tmdb.org/t/p/w154/6nakbcpJ8XGtn4gdVCkAL4IdZtm.jpg,https://www.youtube.com/watch?v=sF-P1dBwefg,"Quatre moments de la vie de quatre personnages féminins. Une petite fille de la campagne, prise dans une tragique partie de cache-cache. Une adolescente ballotée de fugue en fugue, d'homme en homme, puisque tout vaut mieux que le triste foyer familial. Une jeune fille qui monte à Paris et frôle la catastrophe. La femme accomplie enfin, qui se croyait à l'abri de son passé. Peu à peu, ces figures forment une seule et même héroïne.",Orpheline,"Crime, Drama, Thriller","en, fr"
tt4761112,18.25,"['GB', 'US']",7.5,actor,Tahar Rahim,1981,The Mauritanian - The Mauritanian,66190.0,129.0,2021,https://image.tmdb.org/t/p/w154/bVdIarQSID81eELVcBaXjDC0Q45.jpg,https://www.youtube.com/watch?v=N00DwEsSSYU,"Capturé par le gouvernement américain, Mohamedou Ould Slahi est détenu depuis des années à Guantánamo, sans jugement ni inculpation. À bout de forces, il se découvre deux alliées inattendues : l’avocate Nancy Hollander et sa collaboratrice Teri Duncan. Avec ténacité, les deux femmes vont affronter l’implacable système au nom d’une justice équitable. Leur plaidoyer polémique, ainsi que les preuves découvertes par le redoutable procureur militaire, le lieutenant-colonel Stuart Couch, finiront par démasquer une conspiration aussi vaste que scandaleuse. L’incroyable histoire vraie d’un combat acharné pour la survie et les droits d’un homme.",The Mauritanian,"Biography, Crime, Drama, Thriller","ar, de, en, fr"
tt4795546,7.654,"['BE', 'FR', 'DE']",6.4,actor,Finnegan Oldfield,1991,Nocturama - Paris Is Happening,5705.0,130.0,2016,https://image.tmdb.org/t/p/w154/u3jrjyPffLludqDtZE7li3JAQ0R.jpg,https://www.youtube.com/watch?v=S7uxLt7oPHs,"Paris, un matin. Une poignée de jeunes, de milieux différents. Chacun de leur côté, ils entament un ballet étrange dans les dédales du métro et les rues de la capitale. Ils semblent suivre un plan. Leurs gestes sont précis, presque dangereux. Ils convergent vers un même point, un Grand Magasin, au moment où il ferme ses portes. La nuit commence.",Nocturama,"Drama, Thriller","en, fr"
tt4854098,0.6,['CH'],6.5,actor,Cyril Delachaux,1987,2021 - 2021,6731.0,79.0,2018,https://image.tmdb.org/t/p/w154/mAxuZr74ymEwMt8AJGGFUu8f1Bq.jpg,https://www.youtube.com/watch?v=Jtygk8MvlB8,"Unique personnage vivant que l’on verra de tout le film, le héros est en apnée quelques mètres sous l’eau quand survient un étrange éclair vert. Seul sur un bateau de plaisance, il se rend bientôt compte que ses semblables manquent à l’appel. Il rejoint une ville côtière à l’allure fantomatique, comme figée dans le temps, sans traces de cadavres ni de violences particulières. Alors que les avions tombent du ciel, il observe le monde s’embraser silencieusement.",2021,"Adventure, Science Fiction","en, fr"
tt4961016,1.879,"['FR', 'CN']",6.5,actress,Bingbing Fan,1981,The Lady in the Portrait - The Lady in the Portrait,6742.0,108.0,2017,https://image.tmdb.org/t/p/w154/JSPK70f4c2T5GTJLFGWfLFt4tN.jpg,https://www.youtube.com/watch?v=wCs6Dk_n1vw,"Au milieu du XVIIIème siècle, le jésuite Jean-Denis Attiret est un des peintres officiels de la cour impériale de Chine. Il se voit confier la tâche honorifique de peindre le portrait de l’impératrice Ulanara. Cette concubine devenue impératrice à la suite de la mort de la première femme de l’empereur Qjen Long aura un destin très particulier. Sorte de figure romantique avant l’heure, il ne restera d’elle que ce portrait à la sensualité énigmatique de la Joconde asiatique. Le film raconte ce moment fiévreux où l’impératrice chinoise rencontre le peintre jésuite.",Le Portrait interdit,"Drama, Romance","en, fr, zh"
tt5013056,30.058,"['FR', 'NL', 'GB', 'US']",7.8,actor,Fionn Whitehead,1997,Dunkirk - Dunkirk,773439.0,106.0,2017,https://image.tmdb.org/t/p/w154/1VOKlC35yrwVKlfBSN52NY4zoF2.jpg,https://www.youtube.com/watch?v=mGpJMbfJjfU,"Au début de la Seconde Guerre mondiale, en mai 1940, environ 400 000 soldats britanniques, français et belges se retrouvent encerclés par les troupes allemandes dans la poche de Dunkerque. L'Opération Dynamo est mise en place pour évacuer le Corps expéditionnaire britannique (CEB) vers l'Angleterre. L'histoire s'intéresse aux destins croisés des soldats, pilotes, marins et civils anglais durant l'Opération Dynamo. Alors que le CEB est évacué par le port et les plages de Dunkerque, trois soldats britanniques, avec un peu d'ingéniosité et de chance, arrivent à embarquer sous les bombardements. Un périple bien plus grand les attend : la traversée du détroit du Pas de Calais.",Dunkirk,"Action, Drama, History, War","de, en, fr"
tt5029608,10.64,"['FR', 'DE']",7.5,actor,Pierre Niney,1989,Frantz - Frantz,18474.0,113.0,2016,https://image.tmdb.org/t/p/w154/tBCL7di8Y1BA9RAzQSoKOjtdPqj.jpg,https://www.youtube.com/watch?v=oop8_CgSgmo,"Au lendemain de la Première Guerre mondiale, dans une petite ville allemande, Anna se rend tous les jours sur la tombe de son fiancé, mort sur le front en France. Mais ce jour-là, un français est venu, lui aussi, fleurir la tombe de son ami allemand.",Frantz,"Drama, History, Romance","de, en, fr"
tt5029642,4.031,"['FR', 'SE']",6.5,actor,Jérémie Elkaïm,1978,Into the Forest - Into the Forest,6777.0,103.0,2016,https://image.tmdb.org/t/p/w154/rz6GH8DQwelTNoS1gH1UHkfOtY0.jpg,https://www.youtube.com/watch?v=_TRSvK-Omwc,"Tom et son grand frère Benjamin partent en Suède retrouver leur père pour les vacances d'été. Tom appréhende les retrouvailles avec cet homme étrange et solitaire. Le père, lui, semble convaincu que Tom a le don de voir des choses que les autres ne voient pas.  Quand il leur propose d'aller vers le Nord pour passer quelques jours dans une cabane au bord d’un lac, les enfants sont ravis. Mais l'endroit est très isolé, au milieu d'une immense forêt qui exacerbe les peurs de Tom. Et plus les jours passent, moins le père semble envisager leur retour…",Dans la forêt,"Drama, Horror, Thriller","en, fr"
tt5038372,10.389,"['BE', 'FR']",7.0,actress,Léonie Souchaud,2002,Fanny's Journey - Fanny's Journey,1831.0,94.0,2016,https://image.tmdb.org/t/p/w154/jtOsepRNhK7rWaXRaYz2jkBmit3.jpg,https://www.youtube.com/watch?v=xKI1f2402ww,"Du haut de ses 12 ans, Fanny a la tête dure ! Mais c'est surtout une jeune fille courageuse qui, cachée dans un foyer loin de ses parents, s’occupe de ses deux petites sœurs. Devant fuir précipitamment, Fanny prend alors la tête d’un groupe de huit enfants, et s’engage dans un dangereux périple à travers la France occupée pour rejoindre la frontière Suisse.Entre les peurs, les fous rires partagés et les rencontres inattendues, le petit groupe fait l'apprentissage de l'indépendance et découvre la solidarité et l'amitié",Le voyage de Fanny,"Drama, History, War","en, fr"
tt5048406,2.323,['FR'],6.5,actor,Pascal Cervo,1977,4 Days in France - 4 Days in France,6750.0,137.0,2016,https://image.tmdb.org/t/p/w154/6zRHoW96AMigT14chjnTDK0J4k9.jpg,https://www.youtube.com/watch?v=suq7cLGbHcY,"Au petit matin, Pierre quitte Paul. Au volant de son Alfa Roméo, il traverse la France, ses plaines, ses montagnes, sans destination précise. Pierre utilise Grindr, une application de son téléphone portable qui recense et localise pour lui les occasions de drague. Mais Paul y a recours aussi pour mieux le suivre. Au terme de quatre jours et quatre nuits de rencontres – sexuelles ou non – parviendront-ils à se retrouver ?",Jours de France,"Comedy, Drama, Romance","en, fr, it"
tt5061360,10.486,"['BE', 'FR']",7.1,actor,Pierre Niney,1989,Promise at Dawn - La promesse de l'aube,4403.0,131.0,2017,https://image.tmdb.org/t/p/w154/eKpr5YuYnATcDjbVxzJmtEvAWw5.jpg,https://www.youtube.com/watch?v=0EM_XLENEpc,"Adaptation du roman autobiographique de Romain Gary, dans lequel ce dernier évoque sa jeunesse en Lituanie, son exode avec sa famille dans le sud de la France pour échapper aux conséquences de l'arrivée au pouvoir en Allemagne d'Hitler et son parcours dans les Forces Aériennes Françaises Libres.",La Promesse de l'aube,"Biography, Drama, Romance","en, es, fr, pl"
tt5078100,2.183,['FR'],6.5,actress,Mélanie Bernier,1985,The Apple of My Eye - The Apple of My Eye,6755.0,84.0,2016,https://image.tmdb.org/t/p/w154/bCatQ1aEkqAuDdNmNoG4KI9v0A0.jpg,https://www.youtube.com/watch?v=v5H6wE47FrI,"Une fille, un garçon. Elle aime la musique, lui aussi (mais pas la même). Ils se détestent, ils se croisent sans cesse. Et surtout : elle est aveugle, il voit parfaitement. Un jour, par provocation, il se fait passer pour aveugle auprès d'elle. Ce qui n'était qu'une mauvaise blague dure, l'amour arrive, la situation se complique, et la supercherie va devenir explosive.",La Prunelle de mes yeux,"Comedy, Romance","el, en, fr"
tt5078134,5.111,"['BE', 'FR']",6.5,actress,Judith Chemla,1984,A Woman's Life - Une Vie,6787.0,119.0,2016,https://image.tmdb.org/t/p/w154/4oQSrxAzUITlgMtXLnLXRUvppp.jpg,https://www.youtube.com/watch?v=qWQwA_cRH9M,"Normandie, 1819. A peine sortie du couvent où elle a fait ses études, Jeanne Le Perthuis des Vauds, jeune femme trop protégée et encore pleine des rêves de l’enfance, se marie avec Julien de Lamare. Très vite, il se révèle pingre, brutal et volage. Les illusions de Jeanne commencent alors peu à peu à s’envoler.",Une vie,Drama,"en, fr"
tt5078204,16.644,"['FR', 'GB']",7.3,actor,Omar Sy,1978,Two Is a Family - Two Is a Family,31908.0,118.0,2016,https://image.tmdb.org/t/p/w154/1AoQQBmNRgOoavOeUisOPHKPDAF.jpg,https://www.youtube.com/watch?v=QrB7tmqWrAY,"Samuel vit sa vie sans attaches ni responsabilités, au bord de la mer sous le soleil du sud de la France, près des gens qu’il aime et avec qui il travaille sans trop se fatiguer. Jusqu’à ce qu’une de ses anciennes conquêtes lui laisse sur les bras un bébé de quelques mois, Gloria: sa fille! Incapable de s’occuper d’un bébé et bien décidé à rendre l’enfant à sa mère, Samuel se précipite à Londres pour tenter de la retrouver, sans succès. 8 ans plus tard, alors que Samuel et Gloria ont fait leur vie à Londres et sont devenus inséparables, la mère de Gloria revient dans leur vie pour récupérer sa fille…",Demain tout commence,"Comedy, Drama","en, fr"
tt5078214,7.9,['FR'],6.2,actress,Virginie Efira,1977,In Bed with Victoria - Victoria,5447.0,97.0,2016,https://image.tmdb.org/t/p/w154/s2kzTeF4BSNSiUy5GVymIC0Kr7W.jpg,https://www.youtube.com/watch?v=vLXeShFQ1oM,"Victoria Spick, avocate pénaliste en plein néant sentimental, débarque à un mariage où elle y retrouve son ami Vincent et Sam, un ex-dealer qu’elle a sorti d’affaire. Le lendemain, Vincent est accusé de tentative de meurtre par sa compagne. Seul témoin de la scène, le chien de la victime. Victoria accepte à contrecœur de défendre Vincent tandis qu'elle embauche Sam comme jeune homme au pair. Le début d’une série de cataclysmes pour Victoria.",Victoria,"Comedy, Drama, Romance","en, fr"
tt5078354,9.966,['FR'],6.5,actor,Guillaume Canet,1973,Cezanne and I - Cezanne and I,6837.0,117.0,2016,https://image.tmdb.org/t/p/w154/6ErrcTPS1xf05ynSN9VmBOf9686.jpg,https://www.youtube.com/watch?v=GHuuIReTZTE,"Ils s’aimaient comme on aime à treize ans : révoltes, curiosité, espoirs, doutes, filles, rêves de gloires, ils partageaient tout. Paul est riche. Émile est pauvre. Ils quittent Aix, « montent » à Paris, pénètrent dans l’intimité de ceux de Montmartre et des Batignolles. Tous hantent les mêmes lieux, dorment avec les mêmes femmes, crachent sur les bourgeois qui le leur rendent bien, se baignent nus, crèvent de faim puis mangent trop, boivent de l’absinthe, dessinent le jour des modèles qu’ils caressent la nuit, font trente heures de train pour un coucher de soleil... Aujourd’hui Paul est peintre. Émile est écrivain. La gloire est passée sans regarder Paul. Émile lui a tout : la renommée, l’argent une femme parfaite que Paul a aimé avant lui. Ils se jugent, s’admirent, s’affrontent. Ils se perdent, se retrouvent, comme un couple qui n’arrive pas à cesser de s’aimer.",Cézanne et moi,"Biography, Drama, History","en, fr"
tt5080356,1.402,['FR'],6.5,actor,Nicolas Bedos,1980,L'Invitation - The Invitation,6753.0,82.0,2016,https://image.tmdb.org/t/p/w154/5A0vQHHm8lG35dcE1C0EkOLLIrb.jpg,https://www.youtube.com/watch?v=v_Qun742Ebw,"En plein milieu de la nuit, Léo réveille son meilleur pote, Raphaël. Sa voiture est en panne, à une heure de Paris. Hors de question pour Raphaël d’y aller… jusqu’à ce que la femme de sa vie le pousse hors du lit. Arrivé sur place, il découvre qu’il n’y a aucune panne mais du champagne, des amis et une fête improvisée… Léo a fait un test à l’amitié. Et si une amitié, une existence entière ne dépendait que de cette seule question : « Tu te serais levé, toi, pour aller dépanner un pote à 3h du matin ? »",L'Invitation,"Comedy, Drama","en, fr"
