tconst,popularity,production_countries,averageRating,category,primaryName,birthYear,titles,votes,runtime_minutes,start_year,poster_url,video_link,overview,original_title,genres,languages
tt1029234,23.305,"['CA', 'FR']",7.0,actress,Morjana Alaoui,1983,Martyrs - Martyrs,113091.0,99.0,2008,https://image.tmdb.org/t/p/w154/AtKUBX1POUsCNf74VA1wtxdyDzG.jpg,https://www.youtube.com/watch?v=Icd9sddDMHY,"France, début des années 70. Lucie, une petite fille de dix ans, disparue quelques mois plus tôt, est retrouvée errante sur la route. Son corps maltraité ne porte aucune trace d'agression sexuelle. Les raisons de son enlèvement restent mystérieuses. Traumatisée, mutique, elle est placée dans un hôpital où elle se lie d'amitié avec Anna, une fille de son âge. 15 ans plus tard, on sonne à la porte d'une famille ordinaire. Le père ouvre et se retrouve face à Lucie, armée d'un fusil de chasse. Persuadée d'avoir retrouvé ses bourreaux, elle tire.",Martyrs,"Drama, Horror, Thriller","en, fr"
tt10340360,1.446,['FR'],6.5,actress,Séverine Ferrer,1977,The Thing Behind The Door - The Thing Behind the Door,6731.0,81.0,2023,https://image.tmdb.org/t/p/w154/yMBMPRyrgSxuWeswuplS5rTqfsw.jpg,https://www.youtube.com/watch?v=RLCPvAZ_O1M,"France, 1917, Adèle, une jeune paysanne vivant seule dans une ferme isolée, est littéralement hantée par la mort de son mari, tué au front au début de la Première Guerre Mondiale.  Désespérée et incapable de surmonter la douleur provoquée par cette perte tragique, la jeune femme a finalement recours à la magie noire, dans l’espoir de faire « revenir » son bien-aimé.  Le miracle aura bien lieu, mais Adèle va payer très cher l’ouverture de cette véritable boîte de Pandore…",La Chose Derrière La Porte,"Drama, Fantasy, Horror","en, fr"
tt10341034,16.081,['FR'],7.2,actor,Pierre Niney,1989,Black Box - Black Box,17590.0,129.0,2021,https://image.tmdb.org/t/p/w154/jIfFFC4YwiI8TVaGtbl1eT9BRaI.jpg,https://www.youtube.com/watch?v=_dooRWLaKns,"Que s’est-il passé à bord du vol Dubaï-Paris avant son crash dans le massif alpin ? Technicien au BEA, autorité responsable des enquêtes de sécurité dans l’aviation civile, Mathieu Vasseur est propulsé enquêteur en chef sur une catastrophe aérienne sans précédent. Erreur de pilotage ? Défaillance technique ? Acte terroriste ? L’analyse minutieuse des boîtes noires va pousser Mathieu à mener en secret sa propre investigation. Il ignore encore jusqu’où va le mener sa quête de vérité...",Boîte noire,"Drama, Mystery, Thriller","en, fr"
tt1034415,18.026,"['IT', 'US']",6.7,actress,Chloë Grace Moretz,1997,Suspiria - Suspiria,99352.0,152.0,2018,https://image.tmdb.org/t/p/w154/nrGfEZIlgpTUo6vEAyUNedCjYdR.jpg,https://www.youtube.com/watch?v=PH9SO-fGAFI,"Susie Bannion, jeune danseuse américaine, débarque à Berlin dans l'espoir d'intégrer la célèbre compagnie de danse Helena Markos. Madame Blanc, sa chorégraphe, impressionnée par son talent, promeut Susie danseuse étoile. Tandis que les répétitions du ballet final s’intensifient, les deux femmes deviennent de plus en plus proches. C’est alors que Susie commence à faire de terrifiantes découvertes sur la compagnie et celles qui la dirigent…",Suspiria,"Drama, Fantasy, Horror, Thriller","de, en, fr"
tt10345590,24.876,['FR'],5.8,actor,Pio Marmaï,1984,How I Became a Superhero - Comment je suis devenu super-héros,6717.0,97.0,2020,https://image.tmdb.org/t/p/w154/5UDe6oVAIv6PC7eJ046o6oCyQc3.jpg,https://www.youtube.com/watch?v=CI6MV7ZTCbg,"Paris 2020. Dans une société où les surhommes sont banalisés et parfaitement intégrés, une mystérieuse substance procurant des super-pouvoirs à ceux qui n’en ont pas se répand. Face aux incidents qui se multiplient, les lieutenants Moreau et Schaltzmann sont chargés de l’enquête. Avec l’aide de Monté Carlo et Callista, deux anciens justiciers, ils feront tout pour démanteler le trafic. Mais le passé de Moreau ressurgit, et l’enquête se complique...",Comment je suis devenu super-héros,"Action, Adventure, Comedy, Science Fiction, Thriller",fr
tt1035736,11.165,"['BE', 'FR']",6.6,actress,Audrey Tautou,1976,Coco Before Chanel - Coco Avant Chanel,43473.0,105.0,2009,https://image.tmdb.org/t/p/w154/yz5JhT8ecEJLw30tvAN29LOyFcW.jpg,https://www.youtube.com/watch?v=isEnyrd2Moc,"Une petite fille du centre de la France, placée dans un orphelinat avec sa soeur, et qui attend en vain tous les dimanches que son père vienne les chercher. Une chanteuse de beuglant à la voix trop faible, qui affronte un public de soldats éméchés. Une petite couturière destinée à refaire des ourlets dans l'arrière-boutique d'un tailleur de province. Une apprentie-courtisane au corps trop maigre, qui trouve refuge chez son protecteur Etienne Balsan, parmi les cocottes et les fêtards. Une amoureuse qui sait qu'elle ne sera «la femme de personne», pas même celle de Boy Capel, l'homme qui pourtant l'aimait aussi. Une rebelle que les conventions de l'époque empêchent de respirer, et qui s'habille avec les chemises de ses amants. C'est l'histoire de Coco Chanel, qui incarna la femme moderne avant de l'inventer.",Coco avant Chanel,"Biography, Drama, History","en, fr"
tt10366514,11.672,"['BE', 'FR', 'DE']",6.2,actor,Romain Duris,1974,Eiffel - Eiffel,8594.0,108.0,2021,https://image.tmdb.org/t/p/w154/7JrT2FAv4WMZEPXFR9wXWqsyAvl.jpg,https://www.youtube.com/watch?v=STXwmr01J0o,"Venant tout juste de terminer sa collaboration sur la Statue de la Liberté, Gustave Eiffel est au sommet de sa carrière. Le gouvernement français veut qu’il crée quelque chose de spectaculaire pour l’Exposition Universelle de 1889 à Paris, mais Eiffel ne s’intéresse qu’au projet de métropolitain. Tout bascule lorsqu'il recroise son amour de jeunesse. Leur relation interdite l’inspire à changer l’horizon de Paris pour toujours.",Eiffel,"Biography, Drama, History, Romance","en, fr"
tt10375106,9.48,"['BE', 'FR']",6.6,actor,Grégoire Ludig,1982,Mandibles - Mandibules,7202.0,77.0,2020,https://image.tmdb.org/t/p/w154/8YtLJ9xcEHDpE1vsB5fy6PINERZ.jpg,https://www.youtube.com/watch?v=ntbvu_QVc5s,"Jean-Gab et Manu, deux amis simples d'esprit, trouvent une mouche géante coincée dans le coffre d'une voiture et se mettent en tête de la dresser pour gagner de l'argent avec.",Mandibules,"Comedy, Fantasy","en, fr"
tt10376800,1.4,['FR'],6.5,actress,Jade Springer,2005,Little Solange - Petite Solange,6742.0,86.0,2022,https://image.tmdb.org/t/p/w154/dktUdaEiFSzomZuoZBD1weFDlzm.jpg,https://www.youtube.com/watch?v=nZNxLz1uOuQ,"Solange a 13 ans. C’est une toute jeune adolescente d’aujourd’hui, pleine de vie et de curiosité pour l’avenir, avec quelque chose de spécial : elle est sentimentale à l’excès, et adore ses parents. Un jour, ses parents se disputent, se fâchent, commencent à s’éloigner – la mésentente surgit. Tandis que l’ombre du divorce se précise, Solange voit son monde se fissurer. Alors elle va s’inquiéter, réagir, souffrir, bref y croire encore. C’est l’histoire d’une jeune ado trop tendre qui voudrait une chose impossible : que l’amour jamais ne s’arrête.",Petite Solange,Drama,"en, fr"
tt10404944,26.041,['FR'],6.9,actor,Gilles Lellouche,1972,The Stronghold - The Stronghold,15256.0,105.0,2021,https://image.tmdb.org/t/p/w154/r2NnRp4mi4G3e0x9zINQIcnGNd8.jpg,https://www.youtube.com/watch?v=WJg1c3TyikY,"2012. Les quartiers Nord de Marseille détiennent un triste record : la zone au taux de criminalité le plus élevé de France. Poussée par sa hiérarchie, la BAC Nord, brigade de terrain, cherche sans cesse à améliorer ses résultats. Dans un secteur à haut risque, les flics adaptent leurs méthodes, franchissant parfois la ligne jaune. Jusqu'au jour où le système judiciaire se retourne contre eux…",BAC Nord,"Action, Crime, Drama, Thriller","en, fr"
tt10407272,9.924,"['BE', 'FR']",6.6,actor,François Civil,1990,"Someone, Somewhere - Deux Moi",6032.0,110.0,2019,https://image.tmdb.org/t/p/w154/uoyEkQAuhjGywOWGyDQvwFYk2yM.jpg,https://www.youtube.com/watch?v=UVwCgPwfopo,"Rémy et Mélanie ont trente ans et vivent dans le même quartier à Paris. Elle multiplie les rendez-vous ratés sur les réseaux sociaux pendant qu'il peine à faire une rencontre. Tous les deux victimes de cette solitude des grandes villes, à l’époque hyper connectée où l’on pense pourtant que se rencontrer devrait être plus simple… Deux individus, deux parcours. Sans le savoir, ils empruntent deux routes qui les mèneront dans une même direction… celle d’une histoire d'amour ?",Deux moi,"Comedy, Drama, Romance","en, fr"
tt10409498,9.094,"['FR', 'DE']",7.1,actor,Denis Ménochet,1976,Only the Animals - Only the Animals,8427.0,117.0,2019,https://image.tmdb.org/t/p/w154/xhrrWaq2VTIlV5KTRiTZ2pX2AXl.jpg,https://www.youtube.com/watch?v=5HYJ6CjOzi8,"Une femme disparaît. Le lendemain d'une tempête de neige, sa voiture est retrouvée sur une route qui monte vers le plateau où subsistent quelques fermes isolées. Alors que les gendarmes n'ont aucune piste, cinq personnes se savent liées à cette disparition. Chacune a son secret, mais personne ne se doute que cette histoire a commencé loin de cette montagne balayée par les vents d'hiver, sur un autre continent où le soleil brûle, et où la pauvreté n'empêche pas le désir de dicter sa loi.",Seules les Bêtes,"Crime, Drama, Mystery","en, fr"
tt10415798,1.473,"['FR', 'PT']",6.5,actress,Salomé Richard,1987,As Happy As Possible - As Happy as Possible,6738.0,92.0,2019,https://image.tmdb.org/t/p/w154/iHSdy4DTDLH70f6tpDEZaq5jS3k.jpg,https://www.youtube.com/watch?v=N-bdZmWjxzU,"Salomé décroche un job d'été dans la déchetterie d'un village. Sous un soleil de western, dans ce lieu hors du monde, son adolescence rebelle la rattrape. De rencontres inattendues en chagrins partagés, surgit la promesse d’une vie nouvelle.",Rêves de jeunesse,"Comedy, Drama","en, fr"
tt10438512,1.858,"['BE', 'FR']",6.5,actress,Ludivine Sagnier,1979,The Hive - The Hive,6742.0,81.0,2022,https://image.tmdb.org/t/p/w154/h04YKlUUiCjejCPlDAsvgEzDExq.jpg,https://www.youtube.com/watch?v=DLdMK1Dz7dg,"Du plus loin qu'elles s'en souviennent, Marion Claire et Louise ont toujours vécu au rythme des joies et de la douleur d'Alice, leur mère. Aujourd'hui, elles n'ont plus que leur amour à opposer à cette spirale destructice dans laquelle Alice sombre chaque jour davantage. Un amour infini, aussi violent qu’indicible.",La ruche,Drama,"en, fr"
tt10444992,1.277,"['KR', 'FR']",6.5,actress,Agathe Bonitzer,1989,Isadora's Children - Isadora's Children,6747.0,84.0,2019,https://image.tmdb.org/t/p/w154/uLWFdEukrdBFYUPbbwHDAmPV8Nc.jpg,https://www.youtube.com/watch?v=351616671,"Après la mort de ses deux enfants en avril 1913, la danseuse mythique Isadora Duncan a composé un solo intitulé La mère. Dans un geste d'une grande douceur, une mère y caresse et berce une dernière fois son enfant avant de le laisser partir. Un siècle plus tard, quatre femmes font la rencontre de cette danse.",Les enfants d'Isadora,Drama,"en, fr"
tt10456740,19.078,"['BE', 'FR']",6.3,actor,Alban Lenoir,1980,Lost Bullet - Lost Bullet,15265.0,92.0,2020,https://image.tmdb.org/t/p/w154/nrJg7CB2FW35qXgGY0spq6EqDjD.jpg,https://www.youtube.com/watch?v=-qaYywvAyz8,"Petit génie de la mécanique, Lino est réputé pour ses voitures‐béliers. Jusqu’au jour où il se fait arrêter pour un braquage qui tourne mal. Repéré par le chef d’une unité de flics de choc, il se voit proposer un marché pour éviter la prison. Neuf mois plus tard, Lino a largement fait ses preuves. Mais soudain accusé à tort de meurtre, il n’a d’autre choix que de retrouver l’unique preuve de son innocence : la balle du crime, coincée dans une voiture disparue.",Balle perdue,"Action, Crime, Thriller","en, fr"
tt10469804,4.878,['FR'],6.0,actor,Anthony Bajon,1994,Teddy - Teddy,2020.0,88.0,2020,https://image.tmdb.org/t/p/w154/etwEawASSvk9iIY8B3SFkqpRCfc.jpg,https://www.youtube.com/watch?v=8k0zitO8g-c,"Dans les Pyrénées, un loup attise la colère des villageois. Teddy, 19 ans, sans diplôme, vit avec son oncle adoptif et travaille dans un salon de massage. Sa petite amie Rebecca passe bientôt son bac, promise à un avenir radieux. Pour eux, c’est un été ordinaire qui s’annonce. Mais un soir de pleine lune, Teddy est griffé par une bête inconnue. Les semaines qui suivent, il est pris de curieuses pulsions animales…",Teddy,"Comedy, Drama, Horror","en, fr"
tt10505316,7.296,"['BE', 'FR']",7.4,actor,Benjamin Voisin,1996,Lost Illusions - Lost Illusions,7149.0,149.0,2021,https://image.tmdb.org/t/p/w154/wpnN9iRsVmkMe939G62oU3hlnip.jpg,https://www.youtube.com/watch?v=6ltI1Zuar_g,"Lucien est un jeune poète inconnu dans la France du XIXème siècle. Il a de grandes espérances et veut se forger un destin. Il quitte l'imprimerie familiale de sa province natale pour tenter sa chance à Paris, au bras de sa protectrice. Bientôt livré à lui-même dans la ville fabuleuse, le jeune homme va découvrir les coulisses d'un monde voué à la loi du profit et des faux-semblants. Une comédie humaine où tout s'achète et se vend, la littérature comme la presse, la politique comme les sentiments, les réputations comme les âmes. Il va aimer, il va souffrir, et survivre à ses illusions.",Illusions perdues,"Drama, Romance","en, fr"
tt1052353,3.049,['FR'],6.5,actress,Sylvie Testud,1971,Sagan - Sagan,6777.0,117.0,2008,https://image.tmdb.org/t/p/w154/byW3nRtfqkBwcGMO6iPzOtyQOWP.jpg,https://www.youtube.com/watch?v=T9NbyRCCq_E,"« Sur ce sentiment inconnu, dont l'ennui, la douceur m'obsèdent, j'hésite à apposer le nom, le beau nom grave de tristesse. » Françoise a tout juste 18 ans quand elle écrit les premières lignes de Bonjour Tristesse, un roman dont le succès fulgurant suffira à lancer le mythe de « La Sagan ». Un mythe fait de formules brillantes, d'amours affranchies et de scandales tapageurs, derrière lesquels se cache une femme, que l'on qualifie d'anticonformiste pour ne pas la dire libre. Libre d'écrire, d'aimer, et de se détruire...",Sagan,"Biography, Drama","en, fr"
tt10551904,7.578,"['BE', 'FR']",5.8,actor,Laurent Lafitte,1973,Dear Mother - L'origine du monde,2140.0,98.0,2020,https://image.tmdb.org/t/p/w154/n3CRXTh7BBUAHJuaSMhD3vEPVyv.jpg,https://www.youtube.com/watch?v=z7QFD4YBY90,"Jean-Louis réalise en rentrant chez lui que son cœur s'est arrêté. Plus un seul battement dans sa poitrine, aucun pouls, rien. Pourtant, il est conscient, il parle, se déplace. Est-il encore vivant ? Est-il déjà mort ? Ni son ami vétérinaire Michel, ni sa femme Valérie ne trouvent d'explication à cet étrange phénomène. Alors que Jean-Louis panique, Valérie se tourne vers Margaux, sa coach de vie, un peu gourou, pas tout à fait marabout, mais très connectée aux forces occultes. Et elle a une solution qui va mettre Jean-Louis face au tabou ultime...",L'Origine du monde,"Comedy, Drama",fr
tt10600398,28.883,['US'],6.5,actress,YaYa Gosselin,2009,We Can Be Heroes - We Can Be Heroes,7408.0,100.0,2020,https://image.tmdb.org/t/p/w154/bTpoAAP36cbgBcVAtkyCaW4OVX6.jpg,https://www.youtube.com/watch?v=omn2PJEuOTw,"Lorsque des envahisseurs venus de l'espace enlèvent les super-héros de la Terre, les enfants unissent leurs forces pour sauver leurs parents et le monde.",We Can Be Heroes,"Action, Animation, Comedy, Family, Fantasy","en, fr, mo"
tt10627352,9.401,"['BE', 'FR']",5.7,actress,Blanche Gardin,1977,Delete History - Effacer L'historique,2277.0,110.0,2020,https://image.tmdb.org/t/p/w154/5JXC451k9TD9zE4FSrASv66MowV.jpg,https://www.youtube.com/watch?v=KuEYEc9yL_0,"Dans un lotissement en province, trois voisins sont en prise avec les nouvelles technologies et les réseaux sociaux. Il y a Marie, victime de chantage avec une sextape, Bertrand, dont la fille est harcelée au lycée, et Christine, chauffeur VTC dépitée de voir que les notes de ses clients refusent de décoller. Ensemble, ils décident de partir en guerre contre les géants d’internet. Une bataille foutue d'avance, quoique...",Effacer l'historique,"Comedy, Drama","en, fr"
tt10675724,8.372,['FR'],5.3,actress,Suliane Brahim,1978,The Swarm - The Swarm,8629.0,101.0,2020,https://image.tmdb.org/t/p/w154/n3yVHGtvnGTPMdGLrcOhFxXPRD7.jpg,https://www.youtube.com/watch?v=cmQvOO_vlUE,"Difficile pour Virginie de concilier sa vie d’agricultrice avec celle de mère célibataire. Pour sauver sa ferme de la faillite, elle se lance à corps perdu dans le business des sauterelles comestibles. Mais peu à peu, ses enfants ne la reconnaissent plus : Virginie semble développer un étrange lien obsessionnel avec ses sauterelles...",La Nuée,"Drama, Horror","en, fr"
tt1068646,7.397,['FR'],7.5,actor,François Bégaudeau,1971,The Class - Entre les murs,37365.0,128.0,2008,https://image.tmdb.org/t/p/w154/douDslyUiFSfs9e3ep2ngUo2tsH.jpg,https://www.youtube.com/watch?v=lq5qNzm3w-U,"François est un jeune professeur de français dans un collège difficile. Il n'hésite pas à affronter Esmeralda, Souleymane, Khoumba et les autres dans de stimulantes joutes verbales, comme si la langue elle-même était un véritable enjeu. Mais l'apprentissage de la démocratie peut parfois comporter de vrais risques.",Entre les murs,Drama,"bm, fr"
tt1068672,0.91,['FR'],6.5,actress,Clémence Poésy,1982,The Third Part of the World - The Third Part of the World,6732.0,105.0,2008,https://image.tmdb.org/t/p/w154/nQEpqzWV7OB1Z9YI8xBoPULx5ei.jpg,https://www.youtube.com/watch?v=KLgzAeWaeTc,"Emma, une jeune femme mystérieuse, se découvre peu à peu un pouvoir étrange: à son contact, ses amants disparaissent. François, astronome spécialisé dans l’étude du phénomène des trous noirs, rencontre Emma dans un aéroport. Il tombe aussitôt amoureux de cette jeune femme belle et fascinante. Une idylle se noue entre les deux jeunes gens. Mais au bout de quelques jours, François disparaît sans laisser de traces. Avec l’aide de Michel, le frère de François, Emma cherche à percer le mystère de cette disparition – sans se douter qu’elle y est peut-être pour quelque chose…",La troisième partie du monde,"Drama, Fantasy, Mystery, Romance, Science Fiction","en, fr, it"
tt10715194,7.403,['FR'],6.5,actor,Ludovik,1989,Back to School - Back to School,6960.0,83.0,2019,https://image.tmdb.org/t/p/w154/plhaeDj3IR1VFno7LFxHR8Oa0tk.jpg,https://www.youtube.com/watch?v=3F7xqPII6-I,"Impatients d'afficher leur réussite devant d'anciennes brutes et de vieilles conquêtes du collège, deux amis transforment une soirée retrouvailles en nuit de folie...",La Grande Classe,Comedy,"en, fr"
tt1074929,4.085,['CA'],6.3,actor,Devon Bostick,1991,Adoration - Adoration,3555.0,100.0,2009,https://image.tmdb.org/t/p/w154/lMI0shgQDX7z70z3FkSDNtK5bkw.jpg,https://www.youtube.com/watch?v=cl98NxlGKl0,"Un adolescent, Simon, réinvente sa vie sur internet. Son histoire entraîne de vives réactions à travers le monde. Mais le regard des autres peut-il l'aider à faire la paix avec lui-même ?",Adoration,"Drama, Romance","en, fr, he"
tt10749896,2.63,"['FR', 'CH']",6.5,actor,Romain Duris,1974,"Aznavour by Charles - Aznavour, le regard de Charles",6745.0,83.0,2019,https://image.tmdb.org/t/p/w154/j3H9c0dgATU4t25RpZADbXP0Nxr.jpg,https://www.youtube.com/watch?v=YevYih0Dq4M,"En 1948, ‪Edith Piaf‬ offre sa première caméra à ‪Charles Aznavour‬, une Paillard Bolex qui ne le quittera plus. Jusqu’en 1982 Charles filmera des heures de pellicules qui formeront le corpus de son journal filmé. Aznavour filme sa vie et vit comme il filme. Partout où il va, sa caméra est là, avec lui. Elle enregistre tout : les moments de vie, les lieux qu’il traverse, ses amis, ses amours, ses emmerdes…",Le Regard de Charles,"Biography, Documentary, Music","en, fr"
tt10819348,1.4,['CA'],6.5,actor,Éric Bruneau,1983,Crépuscule pour un tueur - Dusk for a Hitman,6730.0,105.0,2023,https://image.tmdb.org/t/p/w154/kZPQ5IJRaPGZz8doaonYhhIOoWr.jpg,https://www.youtube.com/watch?v=tpWBAKw9tBo,"À la fin des années 1970, le tueur à gages le plus redouté de Montréal, Donald Lavoie, se retrouve pourchassé par ses anciens complices et par un policier tenace.",Crépuscule pour un tueur,"Crime, Drama, Thriller","en, fr"
tt10931784,34.077,['US'],5.3,actress,Anna Diop,1988,Nanny - Nanny,8599.0,99.0,2022,https://image.tmdb.org/t/p/w154/i3CC9bkd1I7ifkIS2QSNNZZKVAC.jpg,https://www.youtube.com/watch?v=YCauh8o9m24,"Aisha, une nounou sans papiers, s'occupe d'un enfant privilégié dans l'Upper East Side de New York. Alors qu'elle se prépare à l'arrivée du fils qu'elle a laissé derrière elle en Afrique de l'ouest, une présence surnaturelle envahit son quotidien, menaçant le rêve américain qu'elle a laborieusement construit.",Nanny,"Drama, Horror","en, fr, wo"
tt10933680,18.875,['US'],5.8,actor,Scott Adkins,1976,Debt Collectors - The Debt Collector 2,5847.0,97.0,2020,https://image.tmdb.org/t/p/w154/6FxSZB9VfPIPCogp0hB4O86Wa4Y.jpg,https://www.youtube.com/watch?v=lPDs-BU7y7c,"Instructeur en arts martiaux, French est contraint de travailler pour le redouté Tommy, un criminel local pour le compte duquel il doit jouer les chasseurs de créances. Pour ce faire, French est confié aux bons soins de Sue, un ancien boxeur désabusé et nonchalant qui le prend sous son aile et l'emmène de débiteur en débiteur dans des opérations toujours plus violentes.",Debt Collectors,"Action, Comedy, Crime","en, fr"
tt10940736,3.647,"['AR', 'BE', 'ES', 'FR']",6.5,actor,Daniel Hendler,1976,15 Ways to Kill Your Neighbour - 15 Ways to Kill Your Neighbour,6755.0,98.0,2022,https://image.tmdb.org/t/p/w154/lMO0n5CAMRftZGebjTCXmufuJiZ.jpg,https://www.youtube.com/watch?v=GWtUOuHQ8zM,"Le couple, l’amour et la vie de famille sont de bien belles aventures que vivent José et Lucie. Jusqu’au jour où l’ennui s’installe. Lucie consulte alors un psy pour sauver leur couple. De son côté, José vient me voir, moi, Jean-Claude, leur voisin. Ensemble, nous lançons une nouvelle thérapie. Trinquer, danser et jouer au meurtrier tous les jeudis: la nouvelle recette du bonheur!",Petite fleur,"Comedy, Thriller","de, en, es, fr"
tt10945274,16.435,['FR'],6.3,actor,Vincent Elbaz,1971,Vicky and Her Mystery - Vicky and Her Mystery,3282.0,84.0,2021,https://image.tmdb.org/t/p/w154/kaqCExbRELkJ7qJhFrvCHX5q9aD.jpg,https://www.youtube.com/watch?v=EXuJsmqd-M0,"Stéphane décide d'emménager dans les belles montagnes du Cantal afin de renouer avec sa fille de 8 ans, Victoria, mutique depuis la disparition de sa maman. Lors d'une promenade en forêt, un berger confie à Victoria un chiot nommé "" Mystère "" qui va petit-à-petit lui redonner goût à la vie. Mais très vite, Stéphane découvre que l'animal est en réalité un loup... Malgré les mises en garde et le danger de cette situation, il ne peut se résoudre à séparer sa fille de cette boule de poils d'apparence inoffensive.",Mystère,"Adventure, Drama, Family","en, fr"
tt10965976,4.148,"['BE', 'FR']",6.5,actor,François Damiens,1973,Love Song for Tough Guys - Love Songs for Tough Guys,6784.0,107.0,2021,https://image.tmdb.org/t/p/w154/t9IZxbAtECL36QqdBTPZPnZcTy0.jpg,https://www.youtube.com/watch?v=R905hxmvpD8,"Au cœur d'une ville portuaire où des êtres isolés, habitués à la violence, voient soudain leurs vies bouleversées par le théâtre, la poésie et l'art. Et leurs quotidiens, transformés par l'amour…",Cette musique ne joue pour personne,"Comedy, Drama, Romance","en, fr"
tt11002900,2.999,['FR'],6.5,actress,Sara Forestier,1986,Playlist - Playlist,6777.0,84.0,2021,https://image.tmdb.org/t/p/w154/22hzlozbPeEYZb56BVSZIPrnitH.jpg,https://www.youtube.com/watch?v=0yYcfsYZaWU,"Sophie a 28 ans. Elle aimerait être dessinatrice, mais ce serait tellement plus facile si elle avait fait une école d’art. Elle aimerait aussi trouver l'amour, mais ce serait tellement plus facile s'il vous sautait aux yeux. Elle multiplie les expériences amoureuses et professionnelles. Prendre des coups, beaucoup, en donner, un peu : c’est ça, l’apprentissage. Dans sa tête tourne en boucle Daniel Johnston, qui chante que « l'amour véritable finit bien par vous tomber dessus » ; mais Sophie se demande s'il dit vrai.",Playlist,"Comedy, Drama, Music","en, fr"
tt11013434,10.299,"['BE', 'FR']",6.5,actress,Laure Calamy,1975,"My Donkey, My Lover & I - Antoinette in the Cévennes",4319.0,96.0,2020,https://image.tmdb.org/t/p/w154/3qklGXEiFWUiX2SZgHrTBW8iKte.jpg,https://www.youtube.com/watch?v=MZmgl4TkFBc,"Des mois qu’Antoinette attend l’été et la promesse d’une semaine en amoureux avec son amant, Vladimir. Alors quand celui-ci annule leurs vacances pour partir marcher dans les Cévennes avec sa femme et sa fille, Antoinette ne réfléchit pas longtemps: elle part sur ses traces! Mais à son arrivée, point de Vladimir, mais seulement Patrick, un âne récalcitrant qui va l'accompagner dans son singulier périple…",Antoinette dans les Cévennes,"Adventure, Comedy, Romance","en, fr"
tt11015214,7.761,['US'],7.0,actor,John Hodgman,1971,Class Action Park - Action Park: À vos Risques et Périls,8427.0,90.0,2020,https://image.tmdb.org/t/p/w154/586wCAuU9lDzueBxgKfXQDZWOAE.jpg,https://www.youtube.com/watch?v=mqg48h_uKYM,"Documentaire sur le tristement célèbre parc d'attraction Action Park. Situé à Vermont, New Jersey, ce parc d’attractions est resté en activité pendant 18 ans, malgré des dizaines et des dizaines de blessés, de nombreux procès et six décès. Images d’archives, témoignages de victimes, de visiteurs, du personnel, ainsi que des extraits animés illustrant certaines attractions absolument invraisemblables.",Class Action Park,"Crime, Documentary","en, fr"
