tconst,popularity,production_countries,averageRating,category,primaryName,birthYear,titles,votes,runtime_minutes,start_year,poster_url,video_link,overview,original_title,genres,languages
tt1618447,5.722,"['FR', 'DE']",6.7,actress,Lola Créton,1993,Goodbye First Love - Un Amour De Jeunesse,5924.0,110.0,2011,https://image.tmdb.org/t/p/w154/n6bNage75rYnw72U1cKvQVzMS5x.jpg,https://www.youtube.com/watch?v=7ZAH7bvJNRA,"Camille a 15 ans, Sullivan 19. Ils s’aiment d’un amour passionnel, mais à la fin de l’été, Sullivan s'en va. Quelques mois plus tard, il cesse d'écrire à Camille. Au printemps, elle fait une tentative de suicide. 4 ans plus tard, Camille se consacre à ses études d'architecture. Elle fait la connaissance d’un architecte reconnu, Lorenz, dont elle tombe amoureuse. Ils forment un couple solide. C’est à ce moment qu’elle recroise le chemin de Sullivan…",Un amour de jeunesse,"Drama, Romance","da, de, en, fr"
tt1620935,14.608,['US'],6.8,actor,Miles Teller,1987,Bleed for This - Bleed for This,32282.0,117.0,2016,https://image.tmdb.org/t/p/w154/iYaxD9oV9ERFd2wUfcUtrtj8fM.jpg,https://www.youtube.com/watch?v=0yfWnRKXRac,"L'histoire vraie de Vinny Pazienza. Victime d'un grave accident de voiture l'ayant laissé temporairement paralysé, le boxeur Pazienza est remonté sur le ring un an plus tard, contre l'avis des médecins, animé par une véritable force intérieure...",Bleed for This,"Biography, Drama, Sport","en, fr"
tt16227014,10.878,"['CA', 'US']",7.6,actress,Miranda July,1974,Fire of Love - Fire of Love,15394.0,98.0,2022,https://image.tmdb.org/t/p/w154/vb2Y2RuEltS5bNELO3IqCbjoqZD.jpg,https://www.youtube.com/watch?v=swiaZ7-otNg,"Portrait épique et spectaculaire des volcanologues Katia et Maurice Krafft, tués par une coulée pyroclastique sur le mont Unzen, au Japon, le 3 juin 1991.",Fire of Love,"Biography, Documentary","en, es, fr"
tt16252698,7.643,['FR'],6.6,actor,Franz Rogowski,1986,Passages - Passages,12900.0,91.0,2023,https://image.tmdb.org/t/p/w154/2CjewFRFMcpGh0XFLCCkJTGpP9Z.jpg,https://www.youtube.com/watch?v=BEry0hQ5J-8,"L’histoire de deux hommes qui sont ensemble depuis quinze ans et ce qui se passe quand l’un d’eux a une liaison avec une femme. Tomas, qui vit avec Martin, rencontre une jeune femme, Agathe, avec qui il entame une liaison. Un triangle amoureux s’ébauche sans que cela pose un problème à Tomas alors que les rapports avec Martin et Agathe deviennent de plus en plus difficiles. Tomas devra faire un choix…",Passages,"Drama, Romance","en, fr"
tt1640484,12.937,['US'],5.7,actress,Paula Patton,1975,Jumping the Broom - La Corde Au Cou,11903.0,112.0,2011,https://image.tmdb.org/t/p/w154/5oXTMQ7MpFpsMD1mGE2EjAk94cv.jpg,https://www.youtube.com/watch?v=QsfB725SZuU,"Bienvenue au mariage de Sabrina Watson et Jason Taylor qui sont vraiment faits l'un pour l'autre. Malheureusement, leurs familles composent les ingrédients d'un cocktail d'embêtements. Mme Watson a une allure aristo qui va bien avec son domaine familial de Martha's Vineyard dans lequel la mère de Jason, une femme de Brooklyn, ne semble pas du tout à sa place. Quand les familles se réunissent pour le mariage de Jason et Sabrina, il devient évident que chaque clan a ses traditions... et ses secrets.",Jumping the Broom,"Comedy, Drama","en, fr"
tt1646974,6.334,['FR'],7.1,actress,Sara Forestier,1986,The Names of Love - Le Nom Des Gens,8580.0,100.0,2010,https://image.tmdb.org/t/p/w154/e0QQs3oUe06ob4J9jFhxDCCQILb.jpg,https://www.youtube.com/watch?v=wFWyEzKDEu4,"Bahia Benmahmoud, jeune femme extravertie, se fait une haute idée de l'engagement politique puisqu'elle n'hésite pas à coucher avec ses ennemis pour les convertir à sa cause - ce qui peut faire beaucoup de monde vu qu'en gros, tous les gens de droite sont concernés. En règle générale, elle obtient de bons résultats. Jusqu'au jour où elle rencontre Arthur Martin, comme celui des cuisines, quadragénaire discret, adepte du risque zéro. Elle se dit qu'avec un nom pareil, il est forcément un peu facho. Mais les noms sont fourbes et les apparences trompeuses...",Le Nom des gens,"Comedy, Drama, Romance","en, fr"
tt1646985,2.087,['FR'],6.5,actress,Clara Augarde,1995,Love Like Poison - Un Poison Violent,6746.0,92.0,2010,https://image.tmdb.org/t/p/w154/mhBnZZlinKQVBuBEhkw1QoT2E5j.jpg,https://www.youtube.com/watch?v=aFaTbFDf15A,"Anna, une adolescente de 14 ans, quitte l'internat et rejoint son village. Elle doit profiter des vacances pour faire sa confirmation, dernière étape dans son engagement catholique. A son arrivée, elle découvre que son père, Paul, vient de quitter la maison. Elle retrouve son grand-père qu'elle adore et sa mère qui se replie dans une vie de plus en plus pieuse. Effondrée par l'abandon de son mari, elle trouve refuge auprès d'un prêtre et ami d'enfance. Anna fait aussi la connaissance de Pierre, un adolescent libre et solaire se souciant peu de Dieu. Elle cherche également à revoir son père. Au cours des expériences que traverse Anna, une part secrète d'elle-même cherche à se donner corps et âme. Est-ce à Dieu ou à quelque chose d'autre ? Quelque chose dont elle ne peut encore rien dire et qui la révèle...Ce film est présenté dans le cadre de la Quinzaine des Réalisateurs 2010.",Un poison violent,Drama,"en, fr"
tt1649418,75.098,"['US', 'CZ']",6.5,actor,Ryan Gosling,1980,The Gray Man - The Gray Man,253217.0,122.0,2022,https://image.tmdb.org/t/p/w154/cxHQB6LJz6EUEnnYfBv9o3XWdPe.jpg,https://www.youtube.com/watch?v=1QgbJ929kyw,"""Gray Man"" est le nom de code de l’agent de la CIA Court Gentry, alias Sierra Six. Recruté dans une prison fédérale par son officier traitant, Donald Fitzroy, Gentry était autrefois un redoutable tueur à gages à la solde de la CIA. Mais la situation a radicalement changé : Gentry est désormais la cible de Lloyd Hansen, ancien comparse de la CIA, totalement déterminé à le traquer à travers le monde pour l’éliminer. L’agent Dani Miranda le couvre – et il en aura besoin.",The Gray Man,"Action, Mystery, Thriller","cs, de, en, fr, th"
tt1650048,9.28,"['CA', 'FR']",7.6,actor,Melvil Poupaud,1973,Laurence Anyways - Laurence Anyways,23325.0,168.0,2012,https://image.tmdb.org/t/p/w154/fIb2KnNRt94Vuejev6SkP6QRkEi.jpg,https://www.youtube.com/watch?v=RDoQz5VapLE,"Laurence Anyways, c'est l'histoire d'un amour impossible. Le jour de son trentième anniversaire, Laurence, qui est très amoureux de Fred, révèle à celle-ci, après d'abstruses circonlocutions, son désir de devenir une femme.",Laurence Anyways,"Drama, Romance","en, fr"
tt1651507,1.664,['FR'],6.5,actor,Rachid Yous,1986,Flowers of Evil - Flowers of Evil,6737.0,100.0,2012,https://image.tmdb.org/t/p/w154/ocMgBEwD2EVuavE4zQrwDvrBcRo.jpg,https://www.youtube.com/watch?v=2vT5RCbyK6g,"En juin 2009, suite aux élections controversées en Iran, les rues sont envahies par les manifestants. Le régime islamique, soucieux de contrôler son image, arrête les journalistes. Les citoyens décident de témoigner en filmant et diffusant les événements sur YouTube. Ces images sont livrées brutes et choquantes. À Paris, Anahita affronte ces images et y cherche ses proches. À son contact, Gecko est renvoyé à sa propre histoire, et ensemble, ils entament un combat identitaire, mûs par la volonté de s'affranchir. Peu à peu leur histoire individuelle est contaminée par l'histoire et sa médiatisation incessante et inédite sur Internet.",Flowers of Evil,"Drama, Romance","en, fa, fr"
tt16540514,5.524,"['BE', 'FR']",6.5,actress,Sofia Lesaffre,1997,Deep Fear - Deep Fear,6745.0,80.0,2022,https://image.tmdb.org/t/p/w154/5JC3gEPSUkoBboA4wtFJ7ZMaPjY.jpg,https://www.youtube.com/watch?v=rZctT49UyvQ,"Trois jeunes étudiants, fraîchement diplômés, décident de s’éclater en visitant les catacombes. Ils sont loin de se douter que leur expédition va virer au cauchemar. Sonia et ses deux acolytes, Max et Henry, tenteront d’échapper à une étrange créature qui se cache dans les entrailles de la Terre et de rejoindre la surface pour se sauver des griffes de l’Enfer.",Deep Fear,Horror,"en, fr"
tt1654829,6.423,['FR'],6.0,actress,Audrey Tautou,1976,Thérèse - Thérèse Desqueyroux,4024.0,110.0,2012,https://image.tmdb.org/t/p/w154/a0p0eGseKk4Jt0HvT2mrIdoOld5.jpg,https://www.youtube.com/watch?v=l3f2GRqjxKA,"Dans les Landes, on arrange les mariages pour réunir les terrains et allier les familles. Thérèse Larroque devient Madame Desqueyroux. Toutefois cette jeune femme aux idées avant-gardistes ne respecte pas les conventions ancrées dans la région. Pour se libérer du destin qu’on lui impose, elle tentera tout pour vivre pleinement sa vie…",Thérèse Desqueyroux,Drama,fr
tt1655420,12.392,"['GB', 'US']",6.9,actress,Michelle Williams,1980,My Week with Marilyn - My Week with Marilyn,91401.0,99.0,2011,https://image.tmdb.org/t/p/w154/9lXdwCGS6anH2iyKhLvN6AWt9os.jpg,https://www.youtube.com/watch?v=5yQ3Xcsd6UI,"Au début de l’été 1956, Marilyn Monroe se rend en Angleterre pour la première fois. En pleine lune de miel avec le célèbre dramaturge Arthur Miller, elle est venue tourner LE PRINCE ET LA DANSEUSE, le film qui restera célèbre pour l’avoir réunie à l’écran avec Sir Laurence Olivier, véritable légende du théâtre et du cinéma britanniques, qui en est aussi le metteur en scène. Ce même été, Colin Clark, 23 ans, met pour la première fois le pied sur un plateau de cinéma. Tout juste diplômé d’Oxford, le jeune homme rêve de devenir cinéaste et a réussi à décrocher un job d’obscur assistant sur le plateau. Quarante ans plus tard, Clark racontera ce qu’il a vécu au fil des six mois de ce tournage mouvementé dans son livre, « The Prince, the Showgirl and Me ». Mais il manque une semaine dans son récit… Son second livre, « Une semaine avec Marilyn », relate la semaine magique qu’il a passée, seul, avec la plus grande star de cinéma du monde.",My Week with Marilyn,"Biography, Drama, Romance","en, fr"
tt1656177,10.824,"['CA', 'US']",6.2,actor,Antoine Olivier Pilon,1997,Target Number One - Most Wanted,5905.0,125.0,2020,https://image.tmdb.org/t/p/w154/hMXvOWnc5KFsFMHGnPVuvo4h0cg.jpg,https://www.youtube.com/watch?v=oNobfCpjA8Y,"Daniel Léger, ancien héroïnomane, se retrouve condamné à cent ans de réclusion dans une prison de Bangkok pour trafic de drogues. Un journaliste du Globe and Mail, Victor Malarek, s'intéresse à son histoire. Il s'en prend aux ripoux qui ont accusé Daniel à tort.",Target Number One,"Crime, Drama, History, Thriller","en, fr, th"
tt1660302,4.869,"['BE', 'FR', 'LU', 'CH']",6.8,actress,Émilie Dequenne,1981,Our Children - Loving Without Reason,3233.0,111.0,2012,https://image.tmdb.org/t/p/w154/8G0XbHcU2PEKoIu5y7BY9JeYqaw.jpg,https://www.youtube.com/watch?v=vukNkMtApJ0,"Murielle et Mounir vivent une folle passion et pensent que leur union se poursuivra dans ce même climat jusqu'à la fin de leurs jours. Depuis son plus jeune âge, Mounir loge chez le docteur Pinget, une personne qui prend beaucoup de place dans l'existence du couple. Quand les deux amoureux prennent finalement la décision de se marier, ils se retrouvent peu à peu dans un état de dépendance psychique et matérielle vis-à-vis du médecin. Puis ils décident d'avoir des enfants, ce qui complique encore les relations. Murielle, qui supporte de plus en plus mal l'ambiance étouffante qui règne chez elle, dérive lentement. Un drame terrifiant menace son bonheur et celui des siens...",À perdre la raison,"Crime, Drama, Romance","ar, en, fr"
tt1663202,34.12,"['CA', 'HK', 'TW', 'US']",8.0,actor,Leonardo DiCaprio,1974,The Revenant - The Revenant,911426.0,156.0,2015,https://image.tmdb.org/t/p/w154/AsDto68FNWNXD15Ov0yMXASJiSB.jpg,https://www.youtube.com/watch?v=XJ44ZRFFRUU,"Dans une Amérique profondément sauvage, le trappeur Hugh Glass est sévèrement blessé et laissé pour mort par un traître de son équipe, John Fitzgerald. Avec sa seule volonté pour unique arme, Glass doit affronter un environnement hostile, un hiver brutal et des tribus guerrières, dans une inexorable lutte pour sa survie, portée par un intense désir de vengeance.",The Revenant,"Action, Adventure, Drama, Western","en, fr"
tt1667100,7.28,"['BE', 'FR']",6.1,actress,Virginie Efira,1977,Second Chance - Second Chance,2990.0,87.0,2011,https://image.tmdb.org/t/p/w154/19D673Z1ZlRUWsbqaHBtbzeaBI6.jpg,https://www.youtube.com/watch?v=bdATKjbpQSk,"Julien a un sérieux problème. Depuis son plus jeune âge, il porte la poisse à toutes les femmes qui s'éprennent de lui. Joanna va vite l'apprendre à ses dépens le jour où elle le croise. Une carrière en plein décollage, une vie amoureuse qui semblait enfin prendre un bon tournant, tout cela risque de bien changer...",La Chance de ma vie,"Comedy, Romance","en, fr, ko"
tt1669794,1.206,"['FR', 'BE']",6.5,actress,Christelle Cornil,1977,Miles from Anywhere - Miles from Anywhere,6738.0,82.0,2011,https://image.tmdb.org/t/p/w154/rRgRyel45PBkx6ntSWddHeMdqIr.jpg,https://www.youtube.com/watch?v=6XBrqGSIKho,"Christina, bientôt 30 ans, vit dans la région de Charleroi en Belgique, avec Marco, son petit ami. A la mort de sa grand-mère, elle hérite d’une maison en Corse. Dans son entourage, personne ne semble savoir pourquoi la vieille dame possédait cette maison. Sa famille presse Christina de vendre son bien. Mais elle s’y refuse. Elle veut comprendre pourquoi sa grand-mère lui a laissé cet étrange legs. Elle voit aussi en cet héritage une occasion unique de remettre en question sa vie monotone. Sur un coup de tête, elle part seule à la découverte de sa maison. Ce voyage va bousculer son existence. Et celle de ses proches.",Au cul du loup,Drama,"en, fr"
tt1670345,46.739,['US'],7.2,actor,Jesse Eisenberg,1983,Now You See Me - Now You See Me,738480.0,115.0,2013,https://image.tmdb.org/t/p/w154/dCiHkBku0v0lw0IrGiTRvktLTLc.jpg,https://www.youtube.com/watch?v=fkhNUDh1PP4,"«Les Quatre Cavaliers», un groupe de brillants magiciens et illusionnistes, vient de donner deux spectacles de magie époustouflants: le premier en braquant une banque sur un autre continent, le deuxième en transférant la fortune d’un banquier véreux sur les comptes en banque du public. Deux agents spéciaux du FBI et d’Interpol sont déterminés à les arrêter avant qu’ils ne mettent à exécution leur promesse de réaliser des braquages encore plus audacieux. Ils font appel à Thaddeus, spécialiste reconnu pour expliquer les tours de magie les plus sophistiqués. Alors que la pression s’intensifie, et que le monde entier attend le spectaculaire tour final des Cavaliers, la course contre la montre commence.",Now You See Me,"Crime, Mystery, Thriller","en, fr"
tt1672845,7.126,['GB'],6.5,actor,Luke Treadaway,1984,You Instead - You Instead,4932.0,80.0,2011,https://image.tmdb.org/t/p/w154/hyzqFFwD9d1LWwuunyG3wJddqTv.jpg,https://www.youtube.com/watch?v=DZGT939wTdI,"Adam, pop star américaine, et Morello, une jeune rockeuse britannique indé, doivent se produire dans le même festival rock : T in the Park en Ecosse. Alors que tout les oppose et qu’ils ne se supportent pas, ils se retrouvent menottés l’un à l’autre. Comment vivre le festival ainsi enchaînés - voir leur conjoint, dormir, se laver… et surtout, comment assurer leur concert alors qu’ils ne peuvent pas se séparer ? Malgré tout, petit à petit, Adam semble commencer à apprécier la situation…",You Instead,"Comedy, Drama, Music, Romance","en, fr"
tt1673459,0.776,[],6.5,actress,Mirianne Brûlé,1984,2 Frogs in the West - 2 Frogs in the West,6743.0,105.0,2010,https://image.tmdb.org/t/p/w154/zDysFA6geTCqqRYQQKxepZfya2s.jpg,https://www.youtube.com/watch?v=bIla1lOMV8g,"Marie Deschamps, une jeune Québécoise de vingt ans, suspend ses études collégiales pour aller apprendre l'anglais à dans l'Ouest Canadien. Son voyage la mènera jusqu'à Whistler, en Colombie-Britannique, où elle rencontrera d'autres jeunes âmes un peu perdues, comme elle. Quelque part dans l'Ouest, ces gens et son aventure donneront un sens à sa vie.",2 frogs dans l'ouest,"Biography, Comedy, Drama","en, fr"
tt1680140,5.455,"['DE', 'NZ', 'GB']",5.3,actress,Alice Eve,1982,The Stolen - The Stolen,1656.0,98.0,2017,https://image.tmdb.org/t/p/w154/y7lFBFOhQAxLDURcvGxtIOBLphk.jpg,https://www.youtube.com/watch?v=RDOPiR5IAaI,"L'histoire d'une femme qui veut retrouver son fils kidnappé, parcourant un monde qu'elle ne connaît pas, à la limite du danger à chaque instant.",The Stolen,"Action, Adventure, Drama, Western","en, fr, mi, zh"
tt1687901,12.87,['GB'],6.5,actress,Rebecca Hall,1982,The Awakening - The Awakening,71148.0,102.0,2011,https://image.tmdb.org/t/p/w154/h3NP6WSOXbURn3ufGHclKhJD8ub.jpg,https://www.youtube.com/watch?v=yVCiktvgHb4,"En 1921, l'Angleterre est submergée par la perte et la douleur de la Première Guerre mondiale. Florence Cathcart, qui met au jour des canulars, se rend dans un pensionnat pour expliquer les observations d'un enfant fantôme. Toutes ses convictions seront bouleversées.",The Awakening,"Drama, Horror, Mystery, Thriller","en, fr"
tt16909478,2.761,['FR'],6.5,actor,Thomas Salvador,1973,The Mountain - La Montagne,6749.0,113.0,2023,https://image.tmdb.org/t/p/w154/c5NhJyjA6fCPehiHDuRedZEfdnr.jpg,https://www.youtube.com/watch?v=zerBaxPbA94,"Présent dans les Alpes pour la présentation d'un projet dans le cadre de son travail, Pierre, un ingénieur parisien, décide de rester sur place et laisse ses collègues retourner à Paris sans lui. Ebloui par ces paysages grandioses, il se procure vite le matériel nécessaire pour effectuer une randonnée...",La Montagne,"Adventure, Drama, Fantasy","en, fr"
tt1692098,4.238,['IE'],6.1,actress,Rachel Hurd-Wood,1990,Hideaways - Hideaways,2950.0,88.0,2011,https://image.tmdb.org/t/p/w154/6t1KZODNZqGmd6PNWQgv8D5E4Sz.jpg,https://www.youtube.com/watch?v=1uRFW3mQulo,"Dans la famille Furlong, l’aîné de chaque génération est doté d'un pouvoir extraordinaire, pour le meilleur ou pour le pire. James, le dernier de cette lignée, orphelin de mère, découvre la nature du sien lors d'un accident qui cause la mort de son père et de sa grand-mère. Hanté par ce mal mystérieux, il se retire au plus profond de la forêt pour ne plus nuire à ses proches.... jusqu'à ce qu'il fasse une rencontre inattendue.",Hideaways,"Fantasy, Thriller","en, fr"
tt1692227,3.452,['FR'],6.5,actress,Lizzie Brocheré,1985,American Translation - American Translation,6758.0,109.0,2011,https://image.tmdb.org/t/p/w154/qaVJytYfT6zkP8nSdjz7D6R6PXC.jpg,https://www.youtube.com/watch?v=NV_njOxnXV4,"Un amour se construit sur une rencontre de hasard entre Chris (Pierre Perrier) et Aurore (Lizzie Brocheré). Ils ont vingt ans et vivent une passion exclusive. C'est une belle histoire d'amour comme on en voit qu'au cinéma... Et puis Aurore découvre que Chris tue. Va-t-elle continuer à vivre passionnément, complice malgré elle, ou dénoncer celui qu'elle aime envers et contre tout ?",American Translation,"Drama, Mystery","en, fr"
tt1693679,6.121,['US'],6.5,actor,Wes Bentley,1978,Hirokin: The Last Samurai - Hirokin: The Last Samurai,6769.0,105.0,2012,https://image.tmdb.org/t/p/w154/wp7rC595KFZStJlESJm00HW1IPL.jpg,https://www.youtube.com/watch?v=dUtc7UEGDsQ,"La planète Aradius est devenue un désert stérile. Ses habitants, les Arides, sont sous le joug du Griffon, un sanguinaire tyran humain. Hirokin, guerrier solitaire au passé sombre, est laissé pour mort au milieu de l’étendue désertique après avoir tenté de sauver sa femme et son fils des mains des sbires du Griffon. Secouru par une tribu Aride, il fait la connaissance de Moss, leader de la rébellion. En suivant les enseignements de ce dernier, Hirokin va choisir d’accomplir sa destinée en combattant pour la liberté des opprimés…",Hirokin,"Action, Adventure, Drama, Science Fiction","en, fr"
tt16953666,12.321,"['BE', 'FR']",7.0,actor,Bastien Bouillon,1985,The Night of the 12th - The Night of the 12th,11147.0,115.0,2022,https://image.tmdb.org/t/p/w154/pdvjOATCD51GxMe5XpQb3h7gJON.jpg,https://www.youtube.com/watch?v=_-kMRG6Mg9A,"À la PJ chaque enquêteur tombe un jour ou l’autre sur un crime qu’il n’arrive pas à résoudre et qui le hante. Pour Yohan c’est le meurtre de Clara. Les interrogatoires se succèdent, les suspects ne manquent pas, et les doutes de Yohan ne cessent de grandir. Une seule chose est certaine, le crime a eu lieu la nuit du 12.",La Nuit du 12,"Crime, Drama, Mystery, Thriller","en, fr"
tt1695990,2.552,"['FR', 'DE']",6.5,actress,Isild Le Besco,1982,Deep in the Woods - Deep in the Woods,6748.0,102.0,2010,https://image.tmdb.org/t/p/w154/aH8sQUoIX1Pt3A9vLw0tCuFdppo.jpg,https://www.youtube.com/watch?v=KimGtDhsiE4,"1865, une jeune fille tombe amoureuse de Timothée, un être qui la répugne et la fascine à la fois.",Au fond des bois,"Drama, Romance","en, fr"
tt1699185,2.81,['FR'],6.5,actor,Tahar Rahim,1981,Free Men - Les hommes libres,6754.0,99.0,2011,https://image.tmdb.org/t/p/w154/xnDxh4rWErC1em6ksXinvU8Cpow.jpg,https://www.youtube.com/watch?v=dq1V4vXgiYo,"1942, Paris est occupée par les Allemands. Younes, un jeune émigré algérien, vit du marché noir. Arrêté par la police française, Younes accepte d’espionner pour leur compte à la Mosquée de Paris. La police soupçonne en effet les responsables de la Mosquée, dont le Recteur, Si Kaddour Ben Ghabrit, de délivrer de faux-papiers à des Juifs et à des résistants. A la mosquée, Younes rencontre le chanteur d’origine algérienne Salim Halali. Touché par sa voix et sa personnalité, Younes se lie d’amitié avec lui. Il découvre rapidement que Salim est juif. Malgré les risques encourus, Younes met alors un terme à sa collaboration avec la police. Face à la barbarie qui l’entoure, Younes, l’ouvrier immigré et sans éducation politique, se métamorphose progressivement en militant de la liberté.",Les hommes libres,"Drama, History, Romance",fr
tt1699518,9.565,"['BE', 'FR', 'DE']",6.6,actor,August Diehl,1976,The Young Karl Marx - Le jeune Karl Marx,7690.0,118.0,2017,https://image.tmdb.org/t/p/w154/uoe66bhVdJ01iBe4xWl0VAl1P65.jpg,https://www.youtube.com/watch?v=qssSV56-wO8,"Europe, 1844-1848. En Allemagne, une opposition intellectuelle en pleine ébullition est fortement réprimée. En France, les ouvriers du Faubourg Saint-Antoine se sont mis en marche. En Angleterre aussi, le peuple est dans la rue, la révolution là-bas est industrielle. À 26 ans, Karl Marx entraine sa femme Jenny sur les routes de l'exil. Il parvient à Paris où il rencontre Friedrich Engels, fils d'un grand industriel, qui a étudié les conditions de travail du prolétariat anglais. Ces deux fils de famille, brillants, insolents et drôles, vont parvenir à fédérer un mouvement révolutionnaire et forger les outils théoriques propres à émanciper, par delà les frontières de l'Europe, les peuples opprimés du monde entier.",Le Jeune Karl Marx,"Biography, Drama, History","de, en, fr"
tt17009856,11.194,['FR'],6.8,actor,Paul Kircher,2001,Winter Boy - Le lycéen,1864.0,122.0,2022,https://image.tmdb.org/t/p/w154/2wWJIjOpd00zAHWTkqmJRfN1vP4.jpg,https://www.youtube.com/watch?v=3iCIxtmpdug,"Lucas a 17 ans quand soudain son adolescence vole en éclats. Il voit sa vie comme une bête sauvage qu’il lui faut dompter. Alors que son frère est monté à Paris et qu’il vit désormais seul avec sa mère, Lucas va devoir lutter pour apprendre à espérer et aimer de nouveau.",Le lycéen,Drama,fr
tt1701995,3.952,['FR'],6.5,actor,François Sagat,1979,Man at Bath - Man at Bath,6763.0,72.0,2010,https://image.tmdb.org/t/p/w154/3PGTqEZfvBWEftraAzjL5B5IEv2.jpg,https://www.youtube.com/watch?v=ebq-fTUvPAE,"Entre Gennevilliers et New-York, Omar et Emmanuel ne s'épargnent rien pour apporter à l'autre la preuve qu'ils ne s'aiment plus.",Homme au bain,Drama,"en, fr"
tt1715356,2.521,['FR'],6.8,actor,Stefano Accorsi,1971,Tous les soleils - Tous les soleils,2008.0,105.0,2011,https://image.tmdb.org/t/p/w154/ncEFK0DEDnqiUJAuaabygdzvIZG.jpg,https://www.youtube.com/watch?v=_qGH07aA1EA,"Alessandro est un professeur italien de musique baroque qui vit à Strasbourg avec Irina, sa fille de 15 ans, en pleine crise, et son frère Crampone, un gentil fou anarchiste qui ne cesse de demander le statut de réfugié politique depuis que Berlusconi est au pouvoir. Parfois, Alessandro a l'impression d'avoir deux adolescents à élever, alors qu'il ne se rend même pas compte qu'il est lui-même démuni face à l'existence. Voulant être un père modèle, il en a oublié de reconstruire sa vie amoureuse, d'autant plus qu'il est entouré d'une bande de copains dont la fantaisie burlesque l'empêche de se sentir seul. Mais au moment où sa fille découvre les premiers émois de l'amour, sans qu'il s'y attende, tout va basculer pour Alessandro ...",Tous les soleils,Comedy,"fr, it"
